ID;video;coder1;coder2;response
p230;video_6;;;Again the triangles move independently and bounces back when they hit the wall. Now the box is there and they also bounce back when hitting this. They never touch each other and they never get into the box. In the end they slow down a little bit.
oma;video_6;;;both triangles bounce from both the sides of the large square and the small square in the middle.
nulle;video_6;;;they are both floating around, but this time the box is in the middle, and it looks less relaxing because they are bouncing into it all the time
Neo;video_6;;;Two triangles are bouncing around a room like two rubber balls, never touching, and never entering the room.
nemt;video_6;;;The triangles are bouncing randomly around in the confined space. For some reason they never hit each other. In the end they loose momentum and start moving slowly.
Nanna;video_6;;;The triangles are floating around
